Actors,Awards,BoxOffice,Country,DVD,Director,Genre,Internet_Movie_Database_Rating,Language,Metacritic_Rating,Metascore,Plot,Poster,Production,Rated,Released,Response,Rotten_Tomatoes_Rating,Runtime,Title,Type,Website,Writer,Year,imdbID,imdbRating,imdbVotes,totalSeasons
"Kal Penn, Jennifer Coolidge, Fred Willard",2 wins & 3 nominations,"$39,739,367",United States,N/A,"Jason Friedberg, Aaron Seltzer","Adventure, Comedy, Fantasy",2.4/10,English,17/100,17,"Four troubled orphans from four separate movie scenarios who are bound together in a wacky chocolate factory after receiving golden tickets to go on an 'epic adventure.' After they escape from the clutches of a very scary Willy Wonka they discover the magical world of 'Gnarnia' through an enchanted wardrobe. There they must seek the help of a randy lion, a hoard of mutants from the x academy, students of witchcraft and wizardry, funky swash-buckling pirates and a mischievous beaver to defeat the evil white bitch!",https://m.media-amazon.com/images/M/MV5BMTA3NDM5ODU3NzleQTJeQWpwZ15BbWU3MDgyMjgyNDE@._V1_SX300.jpg,N/A,PG-13,26 Jan 2007,True,2%,86 min,Epic Movie,movie,N/A,"Jason Friedberg, Aaron Seltzer",2007,tt0799949,2.4,"110,503",
"Josh Lucas, Rachael Taylor, Rohan Nichol",12 wins & 15 nominations,N/A,"Australia, United States",N/A,Kriv Stenders,"Biography, Comedy, Drama",7.3/10,"English, Polish",,N/A,"In the tradition of Hachi: A Dog's Tale (2009), this is the story of a legendary, lovable red dog who roamed the outback looking for his original master, finding his way into the hearts of everyone he meets, bringing people and communities together, some who find love, and others who find themselves. Based on true events.",https://m.media-amazon.com/images/M/MV5BMzM3NTE2NjY5M15BMl5BanBnXkFtZTcwMTY0MzUwNg@@._V1_SX300.jpg,N/A,PG,18 Sep 2012,True,84%,92 min,Red Dog,movie,N/A,"Daniel Taplitz, Louis de Bernières",2011,tt0803061,7.3,"19,787",
"Ryan Gosling, Emily Mortimer, Paul Schneider",Nominated for 1 Oscar. 7 wins & 36 nominations total,"$5,972,884","Canada, United States",N/A,Craig Gillespie,"Comedy, Drama, Romance",7.3/10,"English, Spanish",70/100,70,"In this comedy, Lars Lindstrom is an awkwardly shy young man in a small northern town who finally brings home the girl of his dreams to his brother and sister-in-law's home. The only problem is that she's not real - she's a sex doll Lars ordered off the Internet. But sex is not what Lars has in mind, but rather a deep, meaningful relationship. His sister-in-law is worried for him, his brother thinks he's nuts, but eventually the entire town goes along with his delusion in support of this sweet natured boy that they've always loved.",https://m.media-amazon.com/images/M/MV5BZThiOTA4N2UtNzJiYS00MDI0LWI3OWItYzYxYzU3M2YwM2M4XkEyXkFqcGc@._V1_SX300.jpg,N/A,PG-13,02 Nov 2007,True,81%,106 min,Lars and the Real Girl,movie,N/A,Nancy Oliver,2007,tt0805564,7.3,"159,741",
"Brittany Murphy, Toshiyuki Nishida, Tammy Blanchard",N/A,N/A,"United States, Japan",N/A,Robert Allan Ackerman,"Comedy, Drama, Romance",6.3/10,"English, Japanese",,N/A,"Abby, four years out of college, an aimless child of privilege, comes to Tokyo to be with her boyfriend, who promptly leaves for Osaka. She wants to stay in Tokyo in hopes he'll come back to her, but she's miserable: she speaks little Japanese and has a dull job as a law-firm gopher. She stumbles into the neighborhood ramen shop operated by the aging master chef Maezumi and his wife Reiko. His soup cheers Abby, so she decides to apprentice herself to him. He's uninterested, she's insistent, so he shouts at her and gives her all the cleaning to do. Weeks go by; she's persistent. Will he ever actually teach her to cook? And if he does, will she bring the requisite spirit to the job?",https://m.media-amazon.com/images/M/MV5BYTM2N2ZkNWItMzJlNy00ZDk0LTk4YjYtYjRkMjllZjdlZmQ3XkEyXkFqcGc@._V1_SX300.jpg,N/A,PG-13,23 Oct 2008,True,,102 min,The Ramen Girl,movie,N/A,Becca Topol,2008,tt0806165,6.3,"11,349",
"Riisa Naka, Takuya Ishida, Mitsutaka Itakura",12 wins & 2 nominations total,N/A,Japan,N/A,Mamoru Hosoda,"Animation, Adventure, Comedy",7.7/10,Japanese,66/100,66,"A high-school girl named Makoto acquires the power to travel back in time, and decides to use it for her own personal benefits. Little does she know that she is affecting the lives of others just as much as she is her own.",https://m.media-amazon.com/images/M/MV5BNWNjMTVhNDctZjFiNi00MzQwLTgwMDAtM2UxZTBiOTIyMjk4XkEyXkFqcGc@._V1_SX300.jpg,N/A,TV-PG,15 Jul 2006,True,84%,98 min,The Girl Who Leapt Through Time,movie,N/A,"Yasutaka Tsutsui, Satoko Okudera",2006,tt0808506,7.7,"72,667",
"Eddie Redmayne, Alicia Vikander, Amber Heard",Won 1 Oscar. 32 wins & 80 nominations total,"$11,114,018","United Kingdom, United States, Germany, Denmark, Belgium, Japan",N/A,Tom Hooper,"Biography, Drama",7.1/10,"English, French, German, Ukrainian",66/100,66,"Copenhagen, Denmark, 1926. Einar Wegener (played by Eddie Redmayne) and his wife Gerda (Alicia Vikander) are a happily married couple. Both are artists, Einar preferring landscapes and she portraits. One day Einar poses for a portrait of Gerda's while wearing a dress. This is initially done as a lark, as is the later attendance at a party dressed as a woman. However, Einar soon discovers that she is in fact a woman and over time prefers being Lili. At first she and Gerda try to have her situation ""cured"" but this leads nowhere (other than to many doctors trying to have Lili locked up as a pervert and/or lunatic). Her voyage of self-discovery will ultimately lead to her undergoing the first ever sex-change operation.",https://m.media-amazon.com/images/M/MV5BMjA0NjA4NjE2Nl5BMl5BanBnXkFtZTgwNzIxNTY2NjE@._V1_SX300.jpg,N/A,R,22 Jan 2016,True,65%,119 min,The Danish Girl,movie,N/A,"Lucinda Coxon, David Ebershoff",2015,tt0810819,7.1,"202,490",
"William Atherton, Blythe Auffarth, Blanche Baker",1 win & 1 nomination total,N/A,United States,N/A,Gregory Wilson,"Crime, Drama, Horror",6.5/10,English,29/100,29,"In a quiet suburban town in the summer of 1958, two recently orphaned sisters are placed in the care of their mentally unstable Aunt Ruth. But Ruth's depraved sense of discipline will soon lead to unspeakable acts of abuse and tor...",https://m.media-amazon.com/images/M/MV5BMTUwMDcyNjE1MF5BMl5BanBnXkFtZTcwOTA1Njg0MQ@@._V1_SX300.jpg,N/A,R,17 Oct 2008,True,67%,91 min,The Girl Next Door,movie,N/A,"Daniel Farrands, Philip Nutman, Jack Ketchum",2007,tt0830558,6.5,"30,435",
N/A,1 win.,N/A,"UK, Sweden",N/A,Sasha Snow,Documentary,7.9/10,Russian,,N/A,N/A,N/A,N/A,N/A,10 May 2006,True,,61 min,Conflict Tiger,movie,N/A,N/A,2006,tt0836641,7.9,14,
"Garret Dillahunt, Monica Potter, Tony Goldwyn",1 win & 8 nominations total,"$32,752,215","United States, United Kingdom, South Africa",N/A,Dennis Iliadis,"Horror, Thriller",6.5/10,English,42/100,42,"After kidnapping and torturing two innocent teen girls, a group of people seek refuge in the home of the parents of one of the victimized girls. When the parents find out what happened to their daughter, they plot and carry out revenge on those that hurt her.",https://m.media-amazon.com/images/M/MV5BMjExMTM4MDAwOF5BMl5BanBnXkFtZTcwODcyMDIzMg@@._V1_SX300.jpg,N/A,R,13 Mar 2009,True,42%,113 min,The Last House on the Left,movie,N/A,"Adam Alleca, Carl Ellsworth, Wes Craven",2009,tt0844708,6.5,"103,358",
"Abigail Breslin, Stanley Tucci, Joan Cusack",2 wins & 5 nominations,"$17,657,973","United States, Canada",N/A,Patricia Rozema,"Comedy, Drama, Family",6.5/10,English,63/100,63,"'Kit Kittredge: An American Mystery' centers around a young girl living in the struggles of the Great Depression. 10 year old Kit lives in a boarding house her parents own in Cincinnati, Ohio. She has a passion for writing, &amp; dreams of having something of hers put in the local paper someday. With the help of her friends, Sterling &amp; Ruthie, will her dream finally come true?",https://m.media-amazon.com/images/M/MV5BMWRkOTdjODItMDA2OC00ZWUwLWJmYjEtMmVlZjJlNjIxODdiXkEyXkFqcGc@._V1_SX300.jpg,N/A,G,02 Jul 2008,True,80%,101 min,Kit Kittredge: An American Girl,movie,N/A,"Ann Peacock, Valerie Tripp",2008,tt0846308,6.5,"6,418",
N/A,N/A,N/A,USA,N/A,N/A,"Action, Adventure",7.4/10,English,,N/A,N/A,N/A,N/A,N/A,N/A,True,,N/A,Tiger Mission,game,N/A,N/A,1987,tt0852705,7.4,10,
"Anna Faris, Colin Hanks, Emma Stone",2 nominations,"$48,237,389",United States,N/A,Fred Wolf,Comedy,5.5/10,English,55/100,55,"Finding family. Shelley Darlingson was raised in an orphanage, finally happy when she blossoms into a fox and moves into the Playboy Mansion. Unfortunately, she's summarily expelled on her 27th birthday(she's now too old). In desperation she takes a job as house mother for a sorority of misfits losing their house for lack of members. They have but a few months to find 30 pledges, or a sorority of mean girls will take over their place. Shelley figures that girls will pledge a house that boys find interesting, so she sets out to make the Zetas alluring, not act too smart, and host great parties. Can she succeed, and what about her own makeover? Sabotage is everywhere, plus it's hard to be one's self.",https://m.media-amazon.com/images/M/MV5BODkxMDg0MjM2OF5BMl5BanBnXkFtZTcwMjc0NTU4MQ@@._V1_SX300.jpg,N/A,PG-13,22 Aug 2008,True,44%,97 min,The House Bunny,movie,N/A,"Karen McCullah, Kirsten Smith",2008,tt0852713,5.5,"91,855",
"Anthony Chau-Sang Wong, Collin Chou, Karen Tong",N/A,N/A,China,29 Mar 2005,Kant Leung,"Action, Adventure",4.6/10,"Mandarin, Cantonese",,N/A,"Treasures from the Ching Dynasty's Yuan Ming Gardens are sought by an art dealer, the Chinese authorities, a mobster, and undercover government agents.",https://m.media-amazon.com/images/M/MV5BOGVlNzgyNzAtYjYwMS00NjE5LWE1MWYtOTZmY2Q1MGE4MjE1XkEyXkFqcGdeQXVyMTIxMDUyOTI@._V1_SX300.jpg,N/A,N/A,25 Jul 2006,True,,91 min,"Roaring Dragon, Bluffing Tiger",movie,N/A,Yuji Yang,2000,tt0856262,4.6,33,
"Michael Parks, Melissa Leo, John Goodman",3 wins & 8 nominations total,"$1,104,682",United States,N/A,Kevin Smith,"Action, Horror, Thriller",6.1/10,English,50/100,50,"The teenager Jarod invites his best friends Travis and Billy-Ray to have a foursome with a thirty-eight year-old woman. While driving to meet the woman, Travis hit a car parked on the road. When they meet the woman, she gives spiked beer to them and they pass out. When the three friends wake up, they find that they are trapped in the fundamentalist Five Points Trinity Church of the infamous Pastor Abin Cooper and that they will be killed. Meanwhile the church is under siege by ATF agents led by Agent Joseph Keenan that have been ordered to destroy the terrorist cell. Will the teenagers be saved by the agents of the law enforcement agency?",https://m.media-amazon.com/images/M/MV5BMTQyNjMwMzA1MV5BMl5BanBnXkFtZTcwMzQyNDAxNg@@._V1_SX300.jpg,N/A,R,30 Sep 2011,True,62%,88 min,Red State,movie,N/A,Kevin Smith,2011,tt0873886,6.1,"68,538",
"Mamoru Miyano, Brad Swaile, Vincent Tong",2 wins & 1 nomination total,,Japan,,N/A,"Animation, Crime, Drama",8.9/10,"Japanese, English",,N/A,"After an intelligent yet cynical high school student begins to cleanse the world from evil with the help of a magical notebook that can kill anyone whose name is written on it, international authorities call upon a mysterious detective known as ""L"" to thwart his efforts.",https://m.media-amazon.com/images/M/MV5BYTgyZDhmMTEtZDFhNi00MTc4LTg3NjUtYWJlNGE5Mzk2NzMxXkEyXkFqcGc@._V1_SX300.jpg,,TV-14,21 Oct 2007,True,,24 min,Death Note,series,,N/A,2006–2007,tt0877057,8.9,"407,332",1
"Chung-Kuei Chang, Chiu Chen, Kao Chen",N/A,N/A,"Taiwan, Hong Kong",N/A,Wu Ma,Action,6.5/10,Mandarin,,N/A,"After seeing his father Killed by the master of the Black dragon Gang, a Man known only as Miricle (Or Cloud, In the Chinese version) sets about taking revenge on the entire gang. Wang Tao stars as the Miricle man in this stylish Kung FY film, brilliantly Chrographed by the master of Mayhem Tommy Lee who also co-stars as the Leader of the Black dragon gang.",https://m.media-amazon.com/images/M/MV5BMjQwNzc0OTg5Ml5BMl5BanBnXkFtZTgwNjQ0MTE2ODE@._V1_SX300.jpg,N/A,N/A,01 Nov 1977,True,,85 min,Along Comes a Tiger,movie,N/A,"Kuang Ni, Hsin Wei",1977,tt0905315,6.5,97,
"T Bone Burnett, John Carter Cash, Johnny Cash",N/A,N/A,United States,N/A,N/A,Documentary,6.2/10,English,,N/A,A documentary about the life of Johnny Cash and the making of Walk the Line (2005).,https://m.media-amazon.com/images/M/MV5BZDExODY1OWQtYzAxMC00ZmYzLWEwOTItYWEzZDdkOGM2ZDE4XkEyXkFqcGdeQXVyMTEyMDcwNw@@._V1_SX300.jpg,N/A,N/A,N/A,True,,22 min,Celebrating the Man in Black: The Making of 'Walk the Line',movie,N/A,N/A,2005,tt0923633,6.2,40,
"Emilia Clarke, Peter Dinklage, Kit Harington",Won 59 Primetime Emmys. 397 wins & 655 nominations total,,"United States, United Kingdom",,N/A,"Action, Adventure, Drama",9.2/10,English,,N/A,"In the mythical continent of Westeros, several powerful families fight for control of the Seven Kingdoms. As conflict erupts in the kingdoms of men, an ancient enemy rises once again to threaten them all. Meanwhile, the last heirs of a recently usurped dynasty plot to take back their homeland from across the Narrow Sea.",https://m.media-amazon.com/images/M/MV5BMTNhMDJmNmYtNDQ5OS00ODdlLWE0ZDAtZTgyYTIwNDY3OTU3XkEyXkFqcGc@._V1_SX300.jpg,,TV-MA,17 Apr 2011,True,,57 min,Game of Thrones,series,,"David Benioff, D.B. Weiss",2011–2019,tt0944947,9.2,"2,395,647",8
"Matt Damon, Jason Isaacs, Greg Kinnear",6 nominations total,"$35,053,660","United Kingdom, France, Spain, United States, Japan",N/A,Paul Greengrass,"Action, Drama, Thriller",6.8/10,"English, Arabic",63/100,63,"Following the American invasion of Iraq in 2003 Chief Warrant Officer Roy Miller and his men are charged with finding the so-called weapons of mass destruction, whose existence justified American involvement, according to the Pentagon and their man in Baghdad, Poundstone. Veteran CIA operative Marty tells Miller that there are no weapons, it is a deception to allow the Americans to take over the country and install a puppet leader. Also suspicious of Poundstone is Wall Street Journal reporter Lawrie Dayne, who lets slip to Miller that Poundstone told her he had secret talks in Jordan with an important Iraqi, code-named Magellan, who told him about the weapons, though it now seems likely Magellan's true information was to the contrary. So begins a hunt for the truth. Who's playing whom?",https://m.media-amazon.com/images/M/MV5BMTYzMTA1NDMyNV5BMl5BanBnXkFtZTcwMzUwODY5Mg@@._V1_SX300.jpg,N/A,R,12 Mar 2010,True,53%,115 min,Green Zone,movie,N/A,"Brian Helgeland, Rajiv Chandrasekaran",2010,tt0947810,6.8,"144,435",
"Fabian Bernhardson, Margaretha Byström, Sarah Maya Jackson",1 win,N/A,Sweden,N/A,Anna-Carin Andersson,"Short, Drama",5.3/10,Swedish,,N/A,Simon does not have a mother like any other child. He has two - that live together and kiss when the neighbors are not watching.,N/A,N/A,N/A,12 Jun 2006,True,,29 min,En liten tiger,movie,N/A,Alex Haridi,2006,tt0956177,5.3,16,
"John White, Christopher McDonald, Jake Siegel, Lexie Galante",N/A,N/A,"Canada, USA",N/A,Andrew Waller,Comedy,5.3/10,English,,N/A,"Erik, and Cooze start college and pledge the Beta House fraternity, presided over by none other than legendary Dwight Stifler. But chaos ensues when a fraternity of geeks threatens to stop the debauchery and the Betas have to make a stand for their right to party.",https://m.media-amazon.com/images/M/MV5BMmM4NWY0M2YtZDdhYy00ZmRlLTliMGYtYThmNjQ3NWEyOGU0XkEyXkFqcGdeQXVyMTY5Nzc4MDY@._V1_SX300.jpg,N/A,R,26 Dec 2007,True,,85 min,American Pie Presents: Beta House,movie,N/A,"Erik Lindsay, Adam Herz (characters)",2007,tt0974959,5.3,"62,248",
"Naomi Watts, Sean Penn, Sonya Davison",4 wins & 9 nominations,"$9,540,691","United States, United Arab Emirates",N/A,Doug Liman,"Biography, Drama, Thriller",6.8/10,"English, Arabic, French",69/100,69,Plame's status as a CIA agent was revealed by White House officials allegedly out to discredit her husband after he wrote a 2003 New York Times op-ed piece saying that the Bush administration had manipulated intelligence about weapons of mass destruction to justify the invasion of Iraq.,https://m.media-amazon.com/images/M/MV5BMjIyOTg1NzU0Ml5BMl5BanBnXkFtZTcwMjA2OTY5Mw@@._V1_SX300.jpg,N/A,PG-13,03 Dec 2010,True,78%,108 min,Fair Game,movie,N/A,"Jez Butterworth, John-Henry Butterworth, Joseph Wilson",2010,tt0977855,6.8,"51,602",
"Seth Rogen, Jay Chou, Christoph Waltz",4 wins & 7 nominations total,"$98,780,042",United States,N/A,Michel Gondry,"Action, Comedy, Crime",5.8/10,"English, Mandarin",39/100,39,"Playboy Britt Reid (Seth Rogen) becomes the new publisher of Los Angeles' ""The Daily Sentinel"" after the sudden death of his father. Britt's party life is about to change when he and his driver and kung fu expert, Kato (Jay Chou), stop a robbery. With the help of Kato, Britt starts a new career of fighting crime as the masked superhero ""The Green Hornet"".",https://m.media-amazon.com/images/M/MV5BMTcwOTMwMDYyMl5BMl5BanBnXkFtZTcwMzAxMjMyNA@@._V1_SX300.jpg,N/A,PG-13,14 Jan 2011,True,45%,119 min,The Green Hornet,movie,N/A,"Seth Rogen, Evan Goldberg, George W. Trendle",2011,tt0990407,5.8,"166,263",
"Billie Piper, Iddo Goldberg, Cherie Lunghi",1 nomination total,,United Kingdom,,N/A,Drama,7.3/10,English,,N/A,Based on the popular diary of the anonymous sex worker known only as Belle de Jour.,https://m.media-amazon.com/images/M/MV5BMTM1Njg3MzgwOF5BMl5BanBnXkFtZTcwNzMxMzU3MQ@@._V1_SX300.jpg,,TV-MA,16 Jun 2008,True,,1 min,Secret Diary of a Call Girl,series,,Lucy Prebble,2007–2011,tt1000734,7.3,"14,701",4
"Yu Zhang, Li Ma, Zhiyong Zhang",3 wins & 8 nominations,N/A,China,N/A,Jun Geng,"Comedy, Drama",5.7/10,Mandarin,,N/A,A man tries to sell his pet dog due to the birth of his child.,https://m.media-amazon.com/images/M/MV5BMjYwYmFjNWMtNTdmNy00YjMzLTkwZjMtZTQ5ZmUzMjllNzU4XkEyXkFqcGc@._V1_SX300.jpg,N/A,N/A,14 Jan 2022,True,,118 min,Manchurian Tiger,movie,N/A,"Jun Geng, Bing Liu",2021,tt10097312,5.7,144,
"Brandon Routh, Aníta Briem, Sam Huntington",1 nomination,"$1,186,538",United States,N/A,Kevin Munroe,"Action, Comedy, Crime",5.1/10,English,31/100,31,"The adventures of supernatural private investigator, Dylan Dog, who seeks out the monsters of the Louisiana bayou in his signature red shirt, black jacket, and blue jeans.",https://m.media-amazon.com/images/M/MV5BMTM4ODE1OTU3NF5BMl5BanBnXkFtZTcwMzY2MTEwNQ@@._V1_SX300.jpg,N/A,PG-13,29 Apr 2011,True,5%,107 min,Dylan Dog: Dead of Night,movie,N/A,"Thomas Dean Donnelly, Joshua Oppenheimer, Tiziano Sclavi",2010,tt1013860,5.1,"15,768",
"Taylor Zakhar Perez, Nicholas Galitzine, Uma Thurman",Nominated for 1 Primetime Emmy. 4 wins & 9 nominations total,N/A,United States,N/A,Matthew López,"Comedy, Romance",6.9/10,English,62/100,62,"When the feud between the son of the American President and Britain's prince threatens to drive a wedge in U.S./British relations, the two are forced into a staged truce that sparks something deeper.",https://m.media-amazon.com/images/M/MV5BYzYyMzIyZjQtYzJkYi00M2E4LWI0YTUtOWVlNzk5NGI4YWY1XkEyXkFqcGc@._V1_SX300.jpg,N/A,R,11 Aug 2023,True,75%,118 min,"Red, White & Royal Blue",movie,N/A,"Casey McQuiston, Matthew López, Ted Malawer",2023,tt10172266,6.9,"55,133",
"Moxie Owens, Cody Renee Cameron, Dominique Swain",N/A,N/A,United States,N/A,Robin Bain,"Drama, Thriller",5.2/10,English,,N/A,"Interweaving stories of four different women involved in the sex industry offers a glimpse into the dark underbelly of Los Angeles and the taboo lifestyle of a sex worker. A teen runaway, single mother and two career escorts interconnect through their own personal journeys filled with loss, betrayal and the struggle to survive.",https://m.media-amazon.com/images/M/MV5BMWJlMmM2ZjctMmFkYy00MDczLTg3OWItYmFlYjA2YzczMTYyXkEyXkFqcGc@._V1_SX300.jpg,N/A,Not Rated,01 Dec 2020,True,,90 min,Girl Lost: A Hollywood Story,movie,N/A,Robin Bain,2020,tt10274284,5.2,"9,666",
"Omeed Alomary, Halle Berry, Mark Dacascos",N/A,N/A,United States,N/A,N/A,"Documentary, Short, Action",7.5/10,English,,N/A,Keanu Reeves and Halle Berry star in the third installment of the action film series.,https://m.media-amazon.com/images/M/MV5BYmI2NTIzNWYtYjVkNi00ZmRkLTlkYmUtZTU5YjVjNDMzMTdkXkEyXkFqcGdeQXVyNTE1NjY5Mg@@._V1_SX300.jpg,N/A,TV-14,28 Apr 2019,True,89%,13 min,John Wick: Chapter 3 - Parabellum: HBO First Look,movie,N/A,N/A,2019,tt10275370,7.5,"30,809",
"Kurt Russell, Zoë Bell, Rosario Dawson",8 nominations total,N/A,United States,N/A,Quentin Tarantino,"Drama, Thriller",7.0/10,English,,N/A,"In Austin, Texas, the girlfriends Julia, Arlene and Shanna meet in a bar to drink, smoke and make out with their boyfriends before traveling alone to Lake LBJ to spend the weekend together. They meet the former Hollywood stuntman Mike, who takes Pam out in his ""death-proof"" stunt car. Fourteen months later, Mike turns up in Lebanon, Tennessee and chase Abernathy, Zoë and Kim, but these girls are tough and decide to pay-back the attack.",https://m.media-amazon.com/images/M/MV5BYjRlOTM0OTktZTBjNi00ZjZiLWJkMzktMmU2ZDBkMTQxN2FmXkEyXkFqcGc@._V1_SX300.jpg,N/A,R,31 May 2007,True,67%,127 min,Death Proof,movie,N/A,Quentin Tarantino,2007,tt1028528,7.0,"321,067",
"Benedict Cumberbatch, Kirsten Dunst, Jesse Plemons",Won 1 Oscar. 287 wins & 323 nominations total,N/A,"New Zealand, United Kingdom, Canada, Australia, United States",N/A,Jane Campion,"Drama, Western",6.8/10,English,89/100,89,"Severe, pale-eyed, handsome, Phil Burbank is brutally beguiling. All of Phil's romance, power and fragility is trapped in the past and in the land: He can castrate a bull calf with two swift slashes of his knife; he swims naked in the river, smearing his body with mud. He is a cowboy as raw as his hides. The year is 1925. The Burbank brothers are wealthy ranchers in Montana. At the Red Mill restaurant on their way to market, the brothers meet Rose, the widowed proprietress, and her impressionable son Peter. Phil behaves so cruelly he drives them both to tears, revelling in their hurt and rousing his fellow cowhands to laughter - all except his brother George, who comforts Rose then returns to marry her. As Phil swings between fury and cunning, his taunting of Rose takes an eerie form - he hovers at the edges of her vision, whistling a tune she can no longer play. His mockery of her son is more overt, amplified by the cheering of Phil's cowhand disciples. Then Phil appears to take the boy under his wing. Is this latest gesture a softening that leaves Phil exposed, or a plot twisting further into menace?",https://m.media-amazon.com/images/M/MV5BNzgyMzA2NDEtZWUxNy00MDNmLTllMDYtNzZmNTU5ZWVmMzhlXkEyXkFqcGc@._V1_SX300.jpg,N/A,R,01 Dec 2021,True,94%,126 min,The Power of the Dog,movie,N/A,"Jane Campion, Thomas Savage",2021,tt10293406,6.8,"198,809",
"Janhvi Kapoor, Pankaj Tripathi, Angad Bedi",6 wins & 15 nominations,N/A,India,N/A,"ALi Khan AK, Sharan Sharma","Action, Biography, Drama",5.5/10,Hindi,,N/A,Gunjan Saxena's dream since childhood is to be a pilot she decides to quit her education after 10th to train as pilot.But with changing times the qualification changes finally she manages to fill the form after her graduation but has to back out due to a huge fee.She gets an opportunity to train as a female air force officer in newly started camp and is the only candidate to be selected.Gunjan then heads for further training towards the air force camp where she has to face humiliation from Senior male officers for being the only female in the camp.,https://m.media-amazon.com/images/M/MV5BN2JmMjczOGEtODg3MS00MGYzLWE5OWYtOTBlNGJmODQyOTE4XkEyXkFqcGdeQXVyODE5NzE3OTE@._V1_SX300.jpg,N/A,TV-14,12 Aug 2020,True,100%,112 min,Gunjan Saxena: The Kargil Girl,movie,N/A,"Nikhil Mehrotra, Sharan Sharma, Hussain Dalal",2020,tt10350626,5.5,"35,695",
"Lydia Look, Alan Trong, Elaine Kao",4 wins,N/A,United States,N/A,Paul Kowalski,"Drama, Thriller",5.8/10,"English, Chinese",,N/A,An immigrant mother fears her mentally-ill teenaged son is turning into a school shooter.,https://m.media-amazon.com/images/M/MV5BZDU1MWE4YTEtNzUxMy00MzhmLWE0NzQtOTllZGY2NDU3OTgzXkEyXkFqcGc@._V1_SX300.jpg,N/A,N/A,24 Aug 2021,True,80%,94 min,Paper Tiger,movie,N/A,Paul Kowalski,2020,tt10365730,5.8,197,
"Kate Hudson, Dane Cook, Jason Biggs",1 nomination total,"$19,219,250",United States,N/A,Howard Deutch,"Comedy, Romance",5.8/10,English,34/100,34,"Dustin, an amiable guy, is in love with Alexis, a coworker. When she tells him she just wants to be friends, he hires his roommate Tank, a fast-talking, amoral scoundrel who has a side business: men whose women have dumped them hire Tank to take their ex-girlfriends out on the date from Hell, to drive the women back into their old boyfriends' arms. He takes out Alexis who, against her better judgment, decides she needs some randy fun, so Tank is in a quandary: take Alexis up on her offer, or stay true to his friend. More complications ensue as the wedding of Alexis's sister approaches. Tank seeks advice from his father, Dustin pursues Alexis, and questions of self-worth need answers.",https://m.media-amazon.com/images/M/MV5BMTg4MDg5NjE3Nl5BMl5BanBnXkFtZTcwNzc4ODQ3MQ@@._V1_SX300.jpg,N/A,R,19 Sep 2008,True,14%,101 min,My Best Friend's Girl,movie,N/A,Jordan Cahan,2008,tt1046163,5.8,"47,022",
"Emily Watson, Olivia Williams, Chloe Lea",1 win & 3 nominations total,,"United States, Canada, Hungary",,N/A,"Action, Adventure, Drama",7.3/10,English,,N/A,Two Harkonnen sisters combat forces that threaten the future of humankind and establish the fabled sect that will become known as the Bene Gesserit.,https://m.media-amazon.com/images/M/MV5BOTc2YTFiOTItZmRiNi00OWE5LThhOTEtMmZhMTkzYmRiNjIxXkEyXkFqcGc@._V1_SX300.jpg,,TV-MA,17 Nov 2024,True,,N/A,Dune: Prophecy,series,,"Diane Ademu-John, Alison Schapker",2024–,tt10466872,7.3,"46,712",1
