Actors,Awards,BoxOffice,Country,DVD,Director,Genre,Internet_Movie_Database_Rating,Language,Metacritic_Rating,Metascore,Plot,Poster,Production,Rated,Released,Response,Rotten_Tomatoes_Rating,Runtime,Title,Type,Website,Writer,Year,imdbID,imdbRating,imdbVotes,totalSeasons
"Keith David, Khalil Kain, Freda Foh Shen",3 nominations,N/A,United States,N/A,LeVar Burton,"Biography, Drama, Sport",4.2/10,English,,N/A,Biography of Tiger Woods from his birth to him winning his first golf major at the Augusta Masters in 1997.,https://m.media-amazon.com/images/M/MV5BNzEzODg5MjY5OV5BMl5BanBnXkFtZTcwMDY5NTMyMQ@@._V1_SX300.jpg,N/A,PG-13,12 Apr 1998,True,,90 min,The Tiger Woods Story,movie,N/A,"John Strege, Takashi Bufford",1998,tt0153080,4.2,305,
"Frankie Muniz, Kevin Bacon, Diane Lane",7 wins & 4 nominations total,"$34,134,641",United States,N/A,Jay Russell,"Comedy, Drama, Family",7.0/10,"English, German",61/100,61,"A shy boy is unable to make friends in Yazoo City, Mississippi in 1942, until his parents give him a terrier puppy for his ninth birthday. The dog, which he names Skip, becomes well known and loved throughout the community and enriches the life of the boy, Willie, as he grows into manhood. Based on the best-selling Mississippi memoir by the late Willie Morris.",https://m.media-amazon.com/images/M/MV5BMTc1NDgxMjg5MV5BMl5BanBnXkFtZTYwNTUxODc5._V1_SX300.jpg,N/A,PG,03 Mar 2000,True,73%,95 min,My Dog Skip,movie,N/A,"Willie Morris, Gail Gilchriest",2000,tt0156812,7.0,"21,613",
"John Nolan, Prunella Gee, Sharon Maughan",N/A,,United Kingdom,,N/A,Drama,8.4/10,English,,N/A,"Nick Faunt, a Manchester millionaire's son, leaves home at the height of the Depression to become an artist. When he meets an Irish serving girl, a strange love story begins.",https://m.media-amazon.com/images/M/MV5BOTI2OWEyYmMtOGM0My00ZGE2LTk4YjctMTM2Y2I0YzViMDc0XkEyXkFqcGdeQXVyMTQwMzQ1MA@@._V1_SX300.jpg,,N/A,11 Jul 1973,True,,60 min,Shabby Tiger,series,,N/A,1973–,tt0161191,8.4,20,N/A
"Ryong Keo, Jeong-lee Hwang, Jeong-ah Seo",N/A,N/A,"Hong Kong, South Korea",N/A,Shi-hyeon Kim,"Drama, Action",4.9/10,"Cantonese, Korean, English",,N/A,"Dragon Kong, a victor of a millionaire's martial-arts contest, is about to begin the most dangerous mission of his life. For his prize, the millionaire's ravishing daughter Susan, has been stolen - kidnapped by a Ninja sect headed by Tiger So. a legendary Ninjitsu super-foot. Why tiger has taken Susan, Dragon can only guess, but as the shocking truth begins to dawn, and the final showdown approaches, the violence of the Ninja reaches its fatal peak.",https://m.media-amazon.com/images/M/MV5BYjM5ZGE2NDItOGMxMi00YzliLWIzZjAtNTQ5NTM1YmRkZGU3XkEyXkFqcGdeQXVyMTQxNzMzNDI@._V1_SX300.jpg,N/A,R,29 Feb 1984,True,,95 min,"Secret Ninja, Roaring Tiger",movie,N/A,Cheon-ho Jang,1982,tt0165247,4.9,162,
"Tien-Te Hsu, Chen Yi, Lan Lo",N/A,N/A,Taiwan,N/A,You-Min Ko,"Action, Drama",5.7/10,Mandarin,,N/A,The royal seal has been stolen by a Chinese master criminal who plans to sell it to the Japanese.,https://m.media-amazon.com/images/M/MV5BN2ZmMWQ2NmEtNGJjOC00ZmZiLWJhMDItNTlmNWFmMWJiODY4XkEyXkFqcGc@._V1_SX300.jpg,N/A,R,01 May 1976,True,,86 min,Duel in the Tiger Den,movie,N/A,N/A,1972,tt0165727,5.7,21,
"Forest Whitaker, Henry Silva, John Tormey",1 win & 8 nominations total,"$3,308,029","France, Germany, United States, Japan",N/A,Jim Jarmusch,"Crime, Drama",7.5/10,"English, French",68/100,68,"A hitman who lives by the code of the samurai, works for the mafia and finds himself in their crosshairs when his recent job doesn't go according to plan. Now he must find a way to defend himself and his honor while retaining the code he lives by.",https://m.media-amazon.com/images/M/MV5BYmIzNWI3MTMtNGY4Zi00YWIwLWEyMmQtZjcxOTdhNTQ0ZTE5XkEyXkFqcGc@._V1_SX300.jpg,N/A,R,24 Mar 2000,True,84%,116 min,Ghost Dog: The Way of the Samurai,movie,N/A,Jim Jarmusch,1999,tt0165798,7.5,"99,388",
"Winona Ryder, Angelina Jolie, Clea DuVall",Won 1 Oscar. 9 wins & 11 nominations total,"$28,912,646","United States, Germany",N/A,James Mangold,"Biography, Drama",7.3/10,English,51/100,51,"In 1967, Susanna Kaysen had a headache and chased a bottle of aspirin with a bottle of vodka. This landed her in the mental institution, Claymoore. Here she is diagnosed, by Dr. Melvin Potts, with borderline personality disorder. When she arrives at Claymoore, she is greeted by Nurse Valerie Owens and shown round the woman's ward. Here she meets Georgina Tuskin, a pathological liar who is fixated with The Wizard of Oz; Polly Clark, a childlike schizophrenic; Janet Webber, a sardonic anorexic patient; Daisy Randone, a girl who won't let anyone in her room, and only eats her father's chicken; and Lisa Rowe, a sociopath who controls the other patients, and makes lives hard for the nurses at Claymoore. Through the movie, Lisa gains and loses control over Susanna and we see how bad she really can be. The movie's ending shows Susanna being released from Claymoore after an 18-month stay. How does Susanna take back her control? This movie battles subjects such as mental heath, abuse, self-harm and suicide.",https://m.media-amazon.com/images/M/MV5BZWVhYzdiMTQtMzJkMC00YWEwLTkyNDEtNzkwMGQ3NTBhMzExXkEyXkFqcGc@._V1_SX300.jpg,N/A,R,14 Jan 2000,True,54%,127 min,"Girl, Interrupted",movie,N/A,"Susanna Kaysen, James Mangold, Lisa Loomer",1999,tt0172493,7.3,"219,271",
"Anna Faris, Jon Abrahams, Marlon Wayans",7 wins & 6 nominations total,"$157,019,771",United States,N/A,Keenen Ivory Wayans,Comedy,6.3/10,English,48/100,48,"A group of teenagers including Cindy Campbell and Bobby Prinze, accidentally hit a man when driving, and dispose of the body, but now they are being stalked by a very recognisable masked killer. The victim count increases, whilst Cindy must survive the carnage that has she has seen in so many films before.",https://m.media-amazon.com/images/M/MV5BZGRmMGRhOWMtOTk3Ni00OTRjLTkyYTAtYzA1M2IzMGE3NGRkXkEyXkFqcGc@._V1_SX300.jpg,N/A,R,07 Jul 2000,True,51%,88 min,Scary Movie,movie,N/A,"Shawn Wayans, Marlon Wayans, Buddy Johnson",2000,tt0175142,6.3,"299,646",
"Geoffrey Rush, Famke Janssen, Taye Diggs",1 win & 4 nominations total,"$40,846,082",United States,N/A,William Malone,"Horror, Mystery, Thriller",5.6/10,English,28/100,28,"When an eccentric millionaire offer a group of opposites $1,000,000 to spend the night in a so called ""Haunted House"" with a murderous past, they figure it is a quick way to get quick money and leave. All of them are sure it is some made up story just to mess with their heads a little and test their courage. But, once they stay in the house they start to think about the mistake they made in coming there when mysterious things start to happen.",https://m.media-amazon.com/images/M/MV5BMGY4MDg1MzQtNGI4MC00YzY3LWE5NjctMjQyY2E2NzBkZGUzXkEyXkFqcGc@._V1_SX300.jpg,N/A,R,29 Oct 1999,True,31%,93 min,House on Haunted Hill,movie,N/A,"Robb White, Dick Beebe",1999,tt0185371,5.6,"61,464",
N/A,N/A,N/A,Japan,N/A,N/A,Action,6.1/10,English,,N/A,N/A,https://m.media-amazon.com/images/M/MV5BY2Q0M2JlNjUtMDE0ZS00YTExLWJmZWMtNDY5NjIzNzRmMzQxXkEyXkFqcGdeQXVyNzg5OTk2OA@@._V1_SX300.jpg,N/A,N/A,01 Oct 1985,True,,N/A,Tiger-Heli,game,N/A,N/A,1985,tt0186619,6.1,17,
"Kirsten Storms, Raven-Symoné, Bob Bancroft",2 nominations,N/A,United States,N/A,Kenneth Johnson,"Adventure, Comedy, Family",6.3/10,English,,N/A,"Zenon Car is a trouble-prone 13-year-old girl who, in the year 2049 AD, lives on a space station with the rest of her family. When she runs afoul of Parker Windom, the owner of the station, Zenon is determined to be ""incorrigible"", and as punishment is exiled to the worst place imaginable: The planet earth. After several painful weeks of adjustment to her new surroundings, Zenon enlists the aid of her earthbound pals to return to her ""real"" home with evidence that the ""respectable"" Mr. Windom is up to no good.",https://m.media-amazon.com/images/M/MV5BNDJjOGRhNzYtOTE1Yi00ZjU5LTg3NDktNjZhZjE2ZThlMDIzXkEyXkFqcGc@._V1_SX300.jpg,N/A,TV-G,23 Jan 1999,True,,97 min,Zenon: Girl of the 21st Century,movie,N/A,"Marilyn Sadler, Roger Bollen, Stu Krieger",1999,tt0186726,6.3,"8,583",
"Nicole Kidman, Vincent Cassel, Ben Chaplin",1 win,"$5,142,576","United Kingdom, United States",N/A,Jez Butterworth,"Comedy, Crime, Thriller",6.0/10,"English, Russian",51/100,51,"Internet love connections and mail-order brides rarely ever work out, and John should have known. Having never been lucky in the game of love and tired of waiting for the perfect woman to come along, John decides to take his chances and orders a mail-order bride from Russia online. At first, things seem perfect: his new bride Nadia is a gorgeous woman, and although she may not speak much English, her skills in the bedroom more than make up for any communication problems. When Nadia's 'cousins' unexpectedly arrive to celebrate her birthday, John is drawn into their web of corruption and crime.",https://m.media-amazon.com/images/M/MV5BYTQzOTVlNWMtYWZhNi00ZDRlLThiODgtNmFmMWE4MjE2ZTBmXkEyXkFqcGc@._V1_SX300.jpg,N/A,R,01 Feb 2002,True,59%,93 min,Birthday Girl,movie,N/A,"Tom Butterworth, Jez Butterworth",2001,tt0188453,6.0,"26,507",
"Carey Wilson, Johnny Mitchell, William Bailey",N/A,N/A,United States,N/A,Fred Zinnemann,Short,6.7/10,English,,N/A,"Author Frank R. Stockton, often asked the question, finally decides to divulge the untold ending of his story, The Lady or the Tiger?. The story itself... In olden times, a barbaric king often used the façade of being genial to lull his enemies into a false sense of security. If there was a criminal case that caught his fancy, he would bring the accused into an amphitheater which had two closed doors side by side, one of which he was to open. Behind one door would be a tiger which would maul him to death. Behind the other would be a lady suitable for marriage. Regardless of the accused's past or current situation, a funeral or wedding would then take place depending on which door he opened. The King loved his daughter, who was as cold hearted as him. She was in a clandestine romance with a young man. The King, upon learning this news, sentenced the man to the fate of the amphitheater. The Princess found out behind which door was the tiger and which was the fair damsel. In gesturing to her lover about which door to choose, would she be condemning him to death or into the arms of another woman?",https://m.media-amazon.com/images/M/MV5BMjhhODc3ZWEtMWZkYi00ZTcxLTg0OTUtNTBmNGFhMTE4ZGFmXkEyXkFqcGdeQXVyMzAwOTU1MTk@._V1_SX300.jpg,N/A,N/A,28 Mar 1942,True,,10 min,The Lady or the Tiger?,movie,N/A,"Herman Boxer, Frank R. Stockton",1942,tt0189649,6.7,47,
"Chow Yun-Fat, Michelle Yeoh, Ziyi Zhang",Won 4 Oscars. 101 wins & 132 nominations total,"$128,530,421","China, Taiwan, Hong Kong, United States",N/A,Ang Lee,"Action, Adventure, Drama",7.9/10,"Mandarin, Chinese",94/100,94,"In early nineteenth-century China, in the waning years of the Qing dynasty, the renowned swordsman who yearns for enlightenment, Li Mu Bai, decides to give up his legendary Green Destiny sword: the sharp four-hundred-year-old blade of heroes. To mark the end of a blood-stained career, Li entrusts the excellent female warrior, Yu Shu Lien, with the precious weapon to deliver it to Governor Yu; however, once there, an audacious and nimble masked thief manages to steal it. As Shu Lien is hot on the trail of the skilled burglar, unrequited loves; fervent passions; an unconquerable desire for freedom, and bitter loose ends stand in the way. Can Mu Bai shake off his violent past?",https://m.media-amazon.com/images/M/MV5BMzRmMTU2OWEtZjI0Ni00MGRhLThjOTItZTJiNmM4MDk0ZWU2XkEyXkFqcGc@._V1_SX300.jpg,N/A,PG-13,12 Jan 2001,True,98%,120 min,"Crouching Tiger, Hidden Dragon",movie,N/A,"Hui-Ling Wang, James Schamus, Kuo Jung Tsai",2000,tt0190332,7.9,"285,783",
"Veronica Taylor, Rachael Lillis, Eric Stuart",3 wins & 6 nominations total,"$85,744,662",Japan,N/A,Kunihiko Yuyama,"Animation, Action, Adventure",6.3/10,"Japanese, English",35/100,35,"When a group of scientists are offered funding into genetic research if they agree to try and clone the greatest ever Pokémon, Mew, the end result is success and Mewtwo is born. However Mewtwo is bitter about his purpose in life and kills his masters. In order to become the greatest he throws open a challenge to the world to battle him and his Pokémon. Ash and his friends are one of the few groups of trainers who pass the first test and prepare for battle. However they soon find out about further cloning and Mewtwo's ultimate plan for the earth.",https://m.media-amazon.com/images/M/MV5BNDg0ZDk2N2QtZDQzYi00ZTljLWExODgtZWQ2Y2YzZTA1NjVjXkEyXkFqcGc@._V1_SX300.jpg,N/A,G,12 Nov 1999,True,16%,96 min,Pokémon: The First Movie - Mewtwo Strikes Back,movie,N/A,"Satoshi Tajiri, Takeshi Shudô, Jun'ichi Masuda",1998,tt0190641,6.3,"47,346",
"Tim Andrews, Janell Blanchard, Jeff Boland",N/A,N/A,United States,N/A,Serge Rodnunsky,"Comedy, Family",5.6/10,English,,N/A,"Josh Baker is the youngest son of the rambunctious but loving Baker family who live in a sunny beach side California suburb. He is constantly teased by his brother John and his sisters Erica and Lisa, misunderstood by his parents Andrea and Rick, and taunted by bullies Benjamin and Trevor. He dreams of having a true friend of his own. He wants a pet dog, but his father won't allow it. While playing one day, Josh finds a young puppy who has been separated from his family. Josh adopts the dog and names him Tiger. His parents object, but the kids want him too much for them to say no. Although Tiger doesn't fetch or sit up, he does what no other dog can do . . . he talks to Josh. Of course, when Josh tells his friends about his ""talking dog,"" the whole neighborhood thinks Josh is kooky. When the neighborhood bullies kidnap Tiger, everything changes. What happens next will delight the whole family. What started out as a boy's dream of having his own pet, becomes the adventure of a lifetime.",https://m.media-amazon.com/images/M/MV5BMjIwODA3MzUxNV5BMl5BanBnXkFtZTgwNTYxOTg2NjE@._V1_SX300.jpg,N/A,N/A,N/A,True,,88 min,Tiger,movie,N/A,Serge Rodnunsky,1997,tt0190829,5.6,77,
"Jalal Merhi, Cynthia Rothrock, Loren Avedon",N/A,N/A,Canada,N/A,J. Stephen Maunder,"Action, Fantasy",4.0/10,English,,N/A,"When a psychotic martial artist called Stryker resurrects the long-dead spirits of three ancient Chinese master assassins in an effort to take over the New York underworld, it's up to supercops Tarek Richards and Linda Masterson to stop him. However, it's not so easy to battle the undead, and though Richards apparently holds within him the key to defeating these ""Masters"", he will need the guidance of Stryker's former master to aid him... let the battle begin.",https://m.media-amazon.com/images/M/MV5BMTI4MTI5OTIyMV5BMl5BanBnXkFtZTcwNjk2NTAyMQ@@._V1_SX300.jpg,N/A,R,23 Aug 2000,True,,95 min,Tiger Claws III,movie,N/A,J. Stephen Maunder,1999,tt0197951,4.0,596,
"Val Kilmer, Carrie-Anne Moss, Tom Sizemore",1 nomination,"$17,480,890","United States, Australia",N/A,Antony Hoffman,"Action, Sci-Fi, Thriller",5.7/10,English,34/100,34,"In the near future, Earth is dying. A new colony on Mars could be humanity's only hope. A team of American astronauts, each a specialist in a different field, is making the first manned expedition to the red planet and must struggle to overcome the differences in their personalities, backgrounds and ideologies for the overall good of the mission. When their equipment suffers life-threatening damage and the crew must depend on one another for survival on the hostile surface of Mars, their doubts, fears and questions about God, man's destiny and the nature of the universe become defining elements in their fates. In this alien environment they must come face to face with their most human selves.",https://m.media-amazon.com/images/M/MV5BMTY2MzE0MjAwOF5BMl5BanBnXkFtZTYwNDM4Mzg2._V1_SX300.jpg,N/A,PG-13,10 Nov 2000,True,14%,106 min,Red Planet,movie,N/A,"Chuck Pfarrer, Jonathan Lemkin",2000,tt0199753,5.7,"60,532",
Chi Ling Chiu,N/A,N/A,Hong Kong,N/A,See-Yuen Ng,"Action, Drama",,Cantonese,,N/A,"One of the most renowned Kung-fu forms, the Hung Gar Tiger and Crane pattern, demonstrated by Master Chiu Chi Ling, a direct descendant of the style's originator.",https://m.media-amazon.com/images/M/MV5BMTg5MTg1NDU3N15BMl5BanBnXkFtZTcwMTU3MjAyMQ@@._V1_SX300.jpg,N/A,N/A,N/A,True,,57 min,Tiger and Crane Shaolin Kung Fu,movie,N/A,N/A,1982,tt0201992,N/A,10,
"Ping Wang, Chun-Lung Yu, Miao Tien",N/A,N/A,Taiwan,N/A,Se-Chang Tsai,N/A,4.4/10,N/A,,N/A,"A corrupt and vile warlord rapes and kills the young bride of Chi Yung, a kung fu expert. Filled with hate, Chi Yung swears to avenge his bride as he transforms himself from a passive man to a one man death force.",https://m.media-amazon.com/images/M/MV5BNjI5OTkwMWUtNTRkNy00MDM2LWFhMDMtM2M5Yzc1NjQ5ODY3XkEyXkFqcGdeQXVyNTM3MDMyMDQ@._V1_SX300.jpg,N/A,N/A,20 Apr 1974,True,,89 min,Wild Tiger,movie,N/A,Ao-Hsun Sung,1973,tt0202109,4.4,11,
"Hideki Takahashi, Masako Izumi, Shôbun Inoue",N/A,N/A,Japan,N/A,Akinori Matsuo,"Crime, Drama, History",6.6/10,Japanese,,N/A,"When an ex-con gambler, betrayed by his former gang, falls for a cop's daughter, he is forced to take a deadly street rivalry into his own hands. Also known as: The Dragon and the Tiger",https://m.media-amazon.com/images/M/MV5BOWNiOGM3YzAtYzc0Yi00YjU2LTkyODktMTMyYmZkMWQ2ODQ2XkEyXkFqcGdeQXVyMjIwODg1MjM@._V1_SX300.jpg,N/A,N/A,14 Dec 1966,True,,87 min,The Dragon and the Tiger,movie,N/A,"Hisataka Kai, Hideo Sasai",1966,tt0202880,6.6,19,
"Fei Meng, Lin Lin Li, Chi Lin, Shui-Fan Fung",N/A,N/A,Hong Kong,N/A,Ma Wu,"Action, Drama",4.8/10,Mandarin,,N/A,"Ho Mei Fong is a young woman in trouble, running from a gang of criminals with something of importance hidden in her purse. She dies in Chien Chen's taxi while trying to escape, but not before hiding the purse. Chien Chen is now involved whether he likes it or not, along with Ho Mei's sister, who turns out to be an undercover Hong Kong policewoman. They must solve the mystery of the missing purse and what it contained, while being pursued by the criminals and their hired thugs (led by Jackie Chan).",https://m.media-amazon.com/images/M/MV5BMTMyODY3NTQyNF5BMl5BanBnXkFtZTcwMjE1OTM0MQ@@._V1_SX300.jpg,N/A,N/A,06 Sep 1973,True,,102 min,Small Tiger,movie,N/A,Kuang Ni (screenplay),1973,tt0203233,4.8,166,
Richard Kiley,1 win,N/A,United States,N/A,"Dennis B. Kane, Thomas Skinner",Documentary,8.0/10,English,,N/A,Explore the strange and mysterious world of the tiger.,https://m.media-amazon.com/images/M/MV5BNDI2MTQ2NTAtM2RhOS00NTc3LWFjNTMtYjQ5YjIzZThjYzdlXkEyXkFqcGdeQXVyNTM3MDMyMDQ@._V1_SX300.jpg,N/A,Not Rated,16 Jan 1985,True,,60 min,Land of the Tiger,movie,N/A,Stanley Breeden,1985,tt0206080,8.0,29,
"Masako Nozawa, Nana Yamaguchi, Kei Tomiyama",N/A,,Japan,,N/A,"Animation, Action, Sport",7.3/10,Japanese,,N/A,"Famous wrestler Naoto Date, aka the Tiger Mask, grew up in an orphanage and was taken in by a criminal cartel, the Tiger's Cave, which gave him a good life in return for half his earnings. When he visits his orphanage, he gives them the money that would have gone to the Cave, which marks him for assassination. However, with the people of the orphanage on his mind and standing behind him, he stands up to the Cave and the many wrestlers they send after him.",https://m.media-amazon.com/images/M/MV5BYmMzNDE1MjItODdlZC00ZDBkLTk0YzktODQ5ZWVkMjIzMTk4XkEyXkFqcGc@._V1_SX300.jpg,,N/A,02 Oct 1969,True,,23 min,Tiger Mask,series,,N/A,1969–1971,tt0206516,7.3,590,1
"Martin Lawrence, Nia Long, Paul Giamatti",1 win & 9 nominations total,"$117,559,438","Germany, United States",N/A,Raja Gosnell,"Action, Comedy, Crime",5.2/10,English,33/100,33,"FBI agent Malcolm Turner is known best for being a brilliant, master of disguise. Malcolm's latest assignment sends him to small-town Georgia, where he's assigned to trap a brutal bank robber (and a recent prison escapee) who they suspect will be coming down to visit his ex-girlfriend Sherry and her son. Malcolm sets up a stakeout across from the home of a larger-than-life southern matriarch known as Big Momma, who's about to be visited by Sherry. It's a simple plan, but there's one big problem: Unbeknownst to Sherry, Big Momma has unexpectedly left town. So Malcolm, decides to impersonate the cantankerous Southern granny. Using a few tricks of disguise, he completely transforms himself into Big Momma, even taking on the corpulent septuagenarian's everyday routine-from cooking soul food to delivering babies to ""testifying"" at the local church. In the mean time, Malcolm starts falling for Sherry, who may or may not be hiding some stolen cash. Now, Malcolm/Big Momma must somehow find a way to nab his criminal and the girl.",https://m.media-amazon.com/images/M/MV5BMTg4YWY4MjEtNzQ2NC00MDJjLTg3YWEtZDI1ODkzYjEwNjczXkEyXkFqcGc@._V1_SX300.jpg,N/A,PG-13,02 Jun 2000,True,30%,99 min,Big Momma's House,movie,N/A,"Darryl Quarles, Don Rhymer",2000,tt0208003,5.2,"92,695",
"Veronica Taylor, Rica Matsumoto, Ikue Ôtani",2 nominations total,"$43,758,684","Japan, United States",N/A,Kunihiko Yuyama,"Animation, Action, Adventure",6.1/10,Japanese,28/100,28,"An evil genius in a flying fortress is trying to kidnap the birds of the fire, ice, and lightning islands in hopes of luring the sea power, Lugia, and controlling the world. Ash and his friends, in the process of carrying out an island tradition that requires visiting those three islands, discover the plot and try to stop it. Even the comic villains, Team Rocket, turn good and help out in the end against the threat of world destruction. And Pokemon assemble from all around the world in case they can be of help (but they end up helping only the merchandising).",https://m.media-amazon.com/images/M/MV5BOTE0NzY5MGUtZDdjMi00OTMyLThiYmEtOTc5NWY0NTE3NDA0XkEyXkFqcGc@._V1_SX300.jpg,N/A,G,21 Jul 2000,True,,99 min,Pokémon the Movie 2000,movie,N/A,"Satoshi Tajiri, Takeshi Shudô",1999,tt0210234,6.1,"24,457",
"George Eastman, Krung Srivilai, Kam Wong Lung",N/A,N/A,"Italy, Thailand",N/A,Franco Lattanzi,"Adventure, Western",4.6/10,"Italian, Thai",,N/A,"In Thailand, a young, honest and courageous boy undertakes to remit to the family of his dead American friend all his belongings, jewels and money earned through many years of hard work in a foreign country. But America is far away and ready to destroy and kill for a few dollars! To keep his promise he must travel far, and to move fast to fight his way through unbearable dangers and difficulties.",https://m.media-amazon.com/images/M/MV5BOGJhOWYxMWMtNWY1Zi00MTUxLTg0NDAtZjc3NTg5YjZkY2ZjXkEyXkFqcGdeQXVyMTQ3Njg3MQ@@._V1_SX300.jpg,N/A,N/A,23 Sep 1975,True,,85 min,Tiger from River Kwai,movie,N/A,Armando Visconti,1975,tt0211042,4.6,63,
"Evgeniy Leonov, Aleksey Ptitsyn, Aleksandr Baranov",N/A,N/A,Soviet Union,N/A,Leonid Nosyrev,"Animation, Short, Family",7.6/10,Russian,,N/A,"A small Ussuri tiger cub Amba, fleeing from the severe cold in a snowdrift, found a sprouted sunflower seed and warmed it. The next morning, a huge sunflower grew over the taiga, and in its very center, covered with petals, a tiger cub was sleeping. That is how Amba stayed living on a sunflower. With the onset of autumn strong winds blew, and the sunflower fell to the ground. Tiger cub climbed under the flower and fell asleep. And after a while, the seeds of this sunflower sprouted, a lot of huge flowers grew around the cub.",https://m.media-amazon.com/images/M/MV5BNjU5MmE5OTMtNzA3Ny00NTkxLWFkYjUtZDZjNzc4MjNmNjZkXkEyXkFqcGc@._V1_SX300.jpg,N/A,N/A,N/A,True,,10 min,The Little Tiger on the Sunflower,movie,N/A,"Yuriy Koval, Leonid Nosyrev",1981,tt0212558,7.6,295,
"Marty Grabstein, Thea White, Peter Fernandez",2 wins & 2 nominations total,,"United States, China, Canada, Taiwan, Spain",,N/A,"Animation, Adventure, Comedy",8.3/10,English,,N/A,"The offbeat adventures of Courage, a cowardly dog who must overcome his own fears to heroically defend his unknowing farmer owners from all kinds of dangers, paranormal events and menaces that appear around their land.",https://m.media-amazon.com/images/M/MV5BMzdiMWI4OGMtZDc2MC00NDllLTgyMWUtN2ZmZjVlYWFkYjQxXkEyXkFqcGc@._V1_SX300.jpg,,TV-Y7,12 Nov 1999,True,,33S min,Courage the Cowardly Dog,series,,John Dilworth,1999–2002,tt0220880,8.3,"53,105",4
"Diane Lane, Leelee Sobieski, Stellan Skarsgård",3 nominations total,"$18,150,259",United States,N/A,Daniel Sackheim,"Crime, Drama, Mystery",5.8/10,"English, Spanish, Greek",34/100,34,"When Ruby Baker's parents are killed in a car accident, she and her brother, Rhett, must travel to Malibu, to live with Terrence and Erin Glass, their former neighbors. At first, all seems well. Ruby is making new friends at school and Rhett is getting more video games and flashy toys than he's ever had in his life. When Ruby speaks to her family's estate lawyer, he tells her that her parents have left Rhett and her $4 million. Suddenly, Ruby begins to notice odd behavior from Terry and Erin.",https://m.media-amazon.com/images/M/MV5BMTY3MzA4NzYyOF5BMl5BanBnXkFtZTYwNjk3Nzc5._V1_SX300.jpg,N/A,PG-13,14 Sep 2001,True,21%,106 min,The Glass House,movie,N/A,Wesley Strick,2001,tt0221218,5.8,"40,876",
