Actors,Awards,BoxOffice,Country,DVD,Director,Genre,Internet_Movie_Database_Rating,Language,Metacritic_Rating,Metascore,Plot,Poster,Production,Rated,Released,Response,Rotten_Tomatoes_Rating,Runtime,Title,Type,Website,Writer,Year,imdbID,imdbRating,imdbVotes,totalSeasons
"Theda Bara, Edward Roseman, Louis Dean",N/A,N/A,United States,N/A,"George Bellamy, J. Gordon Edwards",Drama,5.2/10,None,,N/A,"The wicked princess ruins an ambassador, causes a son to kill his father, breaks up the boy's brother's marriage and is finally forced to stab herself by a valet whom she earlier had imprisoned. The ending title is ""The wages of sin is death.""",https://m.media-amazon.com/images/M/MV5BODNjNGQxYzYtMDFhYi00Yjc3LTg5NmUtYWM0YWJhMDMxZDA4XkEyXkFqcGdeQXVyNzk3ODM4NQ@@._V1_SX300.jpg,N/A,N/A,18 Feb 1917,True,,60 min,The Tiger Woman,movie,N/A,"James W. Adams, Adrian Johnson",1917,tt0008677,5.2,14,
"William S. Hart, Jane Novak, Milton Ross",N/A,N/A,United States,N/A,William S. Hart,Western,5.1/10,None,,N/A,"Hawk Parsons and his gang of ruthless outlaws escape from jail and ride far into the New Mexican desert, where they discover a band of emigrants stranded without water. Hawk is so smitten with Ruth Ingram, the wife of the Rev. Luke Ingram, that he agrees to lead the wagon train to safety, but on the way, the party is attacked by Indians. In the distance, Hawk sees U.S. cavalry troops on horseback, but because several members of the posse assigned to track him down are included in the band, he hesitates to send them a distress signal. Finally, Hawk allows the travelers to send their message on the condition that he may leave with Ruth, and as the wagon train is rescued, he reaches his mountain lair with the woman he loves. When Ruth attempts suicide, Hawk then realizes his selfishness, and after returning her to her husband, he turns himself over to the sheriff.",https://m.media-amazon.com/images/M/MV5BOWUwOTVlZjgtZmU1Ni00MDM0LWExNDQtYjkyZWEwYjRmOWUzXkEyXkFqcGdeQXVyNjA5MTAzODY@._V1_SX300.jpg,N/A,N/A,01 Apr 1918,True,,50 min,The Tiger Man,movie,N/A,J.G. Hawks,1918,tt0009700,5.1,19,
"Lenore Ulric, Forrest Stanley, Joseph J. Dowling",2 wins,N/A,United States,N/A,Sidney Franklin,Drama,6.2/10,None,,N/A,"Originally a Broadway play by Willard Macks, Lenore Ulric played the lead on Broadway and reprises her role for this film. At the Wutchi Wum trading post In the peaceful Loon River Valley, deep in the Canadian Northwest comes a story of love, vengeance and sacrifice. Having lived at the trading post following the death of her father, Rose will soon fall in love. But when her new love is in trouble, Rose will discover that she is capable of much more than she thought in order to keep him safe.",https://m.media-amazon.com/images/M/MV5BN2ZlODRkMTItMDNlZi00YTcyLWE5MjgtZjE0ZmMyOWFkMjIzXkEyXkFqcGc@._V1_SX300.jpg,N/A,N/A,15 Dec 1923,True,,80 min,Tiger Rose,movie,N/A,"David Belasco, Edmund Goulding, Willard Mack",1923,tt0014547,6.2,61,
"Priscilla Dean, Matt Moore, Raymond Griffith",N/A,N/A,United States,N/A,Tod Browning,Drama,6.1/10,English,,N/A,"Sylvia Donovan, Roy Donovan, and ""Count Donelli"" are three international crooks who come to America. Sylvia and Roy are unaware that they are brother and sister. The three cooperate to rob wealthy homes by using a gimmick known as a chess-playing machine. Eventually, Sylvia and Roy learn that they are brother and sister and that ""Count Donelli,"" alias Hawkes, killed their father. The detective and Sylvia fall in love.",https://m.media-amazon.com/images/M/MV5BZWZkNzlmZGItMjY0My00YTQyLWJjMzMtYmFlY2VkMmQ0OWVjXkEyXkFqcGc@._V1_SX300.jpg,N/A,Passed,17 Dec 1923,True,,86 min,White Tiger,movie,N/A,"Tod Browning, Charles Kenyon",1923,tt0014606,6.1,270,
"Adolphe Menjou, Evelyn Brent, Rose Dione",N/A,N/A,United States,N/A,Hobart Henley,Drama,6.5/10,None,,N/A,"A variety extra falls in love with a beautiful duchess, and tries to impress her by posing as a rajah. He tells her the truth before anything happens, and leaves.",https://m.media-amazon.com/images/M/MV5BMGMyYjUwZWYtZGNmMC00ZDVhLWE4MDItNTQ0NDU4MDYxZWI0XkEyXkFqcGdeQXVyNjg2NjExMzY@._V1_SX300.jpg,N/A,Passed,27 May 1928,True,,50 min,His Tiger Wife,movie,N/A,"Herman J. Mankiewicz, Alfred Savoir, Ernest Vajda",1928,tt0019004,6.5,13,
"Mikhail Kaufman, Elizaveta Svilova",1 win & 1 nomination total,N/A,Soviet Union,N/A,Dziga Vertov,Documentary,8.3/10,None,96/100,96,"This playful film is at once a documentary of a day in the life of the Soviet Union, a documentary of the filming of said documentary, and a depiction of an audience watching the film. Even the editing of the film is documented. We often see the cameraman who is purportedly making the film, but we rarely, if ever, see any of the footage he seems to be in the act of shooting!",https://m.media-amazon.com/images/M/MV5BZDkzOTYyM2MtYzBmOC00NzIxLThkOGUtNzk5NjI0OWRjZjgzXkEyXkFqcGc@._V1_SX300.jpg,N/A,Not Rated,12 May 1929,True,98%,68 min,Man with a Movie Camera,movie,N/A,Dziga Vertov,1929,tt0019760,8.3,"28,738",
"Frank Merrill, Natalie Kingston, Al Ferguson",N/A,N/A,United States,24 Oct 2006,Henry MacRae,"Action, Adventure",5.4/10,English,,N/A,"After Tarzan's estate is destroyed by Arabs Jane is sold into slavery by a man posing as a friendly scientist. Tarzan develops amnesia after a blow to the head. When he recovers his memory (from a later blow) he defeats the villain, recovers the fabulous jewels of Opar, and rescues Jane.",https://m.media-amazon.com/images/M/MV5BMjEzOTA3MzA5N15BMl5BanBnXkFtZTcwMDcxNDczMQ@@._V1_SX300.jpg,N/A,Passed,09 Dec 1929,True,,266 min,Tarzan the Tiger,movie,N/A,"Edgar Rice Burroughs, Ford Beebe",1929,tt0020481,5.4,158,
"Monte Blue, Lupe Velez, H.B. Warner",N/A,N/A,United States,N/A,George Fitzmaurice,"Action, Drama, Music",6.4/10,English,,N/A,"The spirited young Rose is sought by all the men in a Canadian district. Rose is also loved by sergeant Devlin from the Northwest Mounted Police. Rose, however, has affection only for the railroad worker Bruce, who comes to take her away with him to the big city. Bruce kills Dr. Cusick who tries to prevent Rose from leaving her native haunts. After the murder there is a chase in which Devlin captures Bruce only to release him because of his love for Rose.",https://m.media-amazon.com/images/M/MV5BMzM1NGJlOGQtOTA4ZC00NjkwLTk5YTgtNTkxNGNhY2EwYzhkXkEyXkFqcGdeQXVyMjUxODE0MDY@._V1_SX300.jpg,N/A,Passed,21 Dec 1929,True,,63 min,Tiger Rose,movie,N/A,"Willard Mack, Harvey F. Thew, Gordon Rigby",1929,tt0020503,6.4,29,
"Edward G. Robinson, Richard Arlen, Zita Johann",N/A,N/A,United States,N/A,Howard Hawks,"Drama, Romance",6.4/10,"English, Portuguese",,N/A,Mike is a great tuna fisherman although he lost a hand to a shark years earlier saving Pipes Boley. Now Mike is happily married to Quita and doesn't notice that Pipes and Quita are falling for each other.,https://m.media-amazon.com/images/M/MV5BMjA2ZjNlNWEtOWRjYy00YWQ0LWEyNTEtZDkzNzZlYmNmYTQ4XkEyXkFqcGdeQXVyOTI2MjI5MQ@@._V1_SX300.jpg,N/A,Passed,24 Sep 1932,True,,77 min,Tiger Shark,movie,N/A,"Houston Branch, Wells Root, Howard Hawks",1932,tt0023594,6.4,"1,080",
"Pepe Ortiz, Lupita Gallardo, Adria Delhort",N/A,N/A,Mexico,N/A,Fernando de Fuentes,"Adventure, Drama",6.3/10,Spanish,,N/A,"A good man and his son are kidnapped by a bunch of bandits called 'Los Chacales'. Twenty years after, another band of 'banditos' (Los Plateados) terrorizes the region. The leader of 'Los Plateados', El Tigre (Ortiz), is the boy kidnapped 20 years before. El Tigre knows beautiful Dolores (Gallardo) and decides to conquer her... without knowing she's his long-lost sister.",https://m.media-amazon.com/images/M/MV5BZGI2NjlmYTUtOGUwZC00NmZhLWEyZDAtOTVkYmFmMGFjNGQ4XkEyXkFqcGdeQXVyMTk1MjA1NjU@._V1_SX300.jpg,N/A,N/A,19 Oct 1934,True,,86 min,The Tiger of Yautepec,movie,N/A,"Jorge Pezet, Fernando de Fuentes",1933,tt0024671,6.3,22,
"Marion Burns, Kane Richmond, Harry Woods",N/A,N/A,United States,N/A,Clyde E. Elliott,"Action, Adventure, Romance",4.6/10,English,,N/A,"Africa's fiercest jungle beasts clash in mortal combat in this wild animal adventure thriller. A story of white hunters and a Chinese boy hunting the title beast, that takes a back seat to amazing documentary footage. A crocodile ...",https://m.media-amazon.com/images/M/MV5BYmI0YjMyN2MtYWY5Mi00OGY3LWFlZjctODU5Mjg2N2EyY2UzXkEyXkFqcGdeQXVyMTY5Nzc4MDY@._V1_SX300.jpg,N/A,Approved,08 Feb 1934,True,,60 min,The Devil Tiger,movie,N/A,"James O. Spearing, Russell G. Shields, Lew Lehr",1934,tt0025048,4.6,19,
"Anna May Wong, Henry Victor, Lawrence Grossmith",N/A,N/A,United Kingdom,N/A,J. Elder Wills,"Crime, Drama, Romance",5.9/10,English,,N/A,"A young Englishman abroad, Michael, visits the local low-life spot of Tiger Bay to test his assertion that the spirit of human romance survives even in the most unpromising of circumstances. He intervenes when a local criminal protection racketeer targets a Chinese nightclub, and falls in love with the owner's young English foster-sister. But Olaf's gang have only just started their campaign against Lui Chang, the cultured, elegant woman who owns the premises... and she is determined not to be intimidated or driven out of business under any circumstances...",https://m.media-amazon.com/images/M/MV5BMTQ1OTY2NjgwOF5BMl5BanBnXkFtZTgwODI4Njk1MDE@._V1_SX300.jpg,N/A,Passed,01 Sep 1934,True,,70 min,Tiger Bay,movie,N/A,"Eric Ansell, Billie Bristow, John Quin",1934,tt0025896,5.9,87,
"Barton MacLane, June Travis, Warren Hull",N/A,N/A,United States,N/A,Louis King,"Action, Adventure, Drama",5.1/10,English,,N/A,"Cliff Ballenger, the wild-animal trainer for the circus had no fear of ""Satan,"" the fiercest man-eating tiger in captivity, but the creature hated its master and longed to tear the big man to pieces with its rendering claws and fangs.",https://m.media-amazon.com/images/M/MV5BYjkxYjA0NjItMDYyNS00NzYzLWIzZGMtY2QwNmZjYmY2MTVkXkEyXkFqcGdeQXVyMTY5Nzc4MDY@._V1_SX300.jpg,N/A,Approved,07 Feb 1937,True,,62 min,Bengal Tiger,movie,N/A,"Roy Chanslor, Earl Felton",1936,tt0027349,5.1,153,
"Kitty Jantzen, La Jana, Philip Dorn",N/A,N/A,Germany,N/A,Richard Eichberg,Drama,6.3/10,German,,N/A,"The Maharadscha vom Eschnapur hires a German architect to build a mausoleum. Burning with vengeance when he finds out his young wife has fallen for an adventurer he develops a deadly plan, while flattering the architect's fiancée and fighting ongoing treason.",https://m.media-amazon.com/images/M/MV5BODhlNTFmYzMtZDFjMC00YmM1LTk3NGYtYjAyMTlmODVhOTk4XkEyXkFqcGdeQXVyMzg1ODEwNQ@@._V1_SX300.jpg,N/A,N/A,29 Apr 1938,True,,96 min,The Tiger of Eschnapur,movie,N/A,"Thea von Harbou, Richard Eichberg, Hans Klaehr",1938,tt0030871,6.3,127,
"Marcel Dalio, Nora Gregor, Paulette Dubost",2 wins & 1 nomination,"$273,641",France,N/A,Jean Renoir,"Comedy, Drama",7.9/10,"French, German, English",99/100,99,"On the brink of WWII, the record-breaking aviator, André Jurieux, safely lands at a small airport crammed with reporters, only to come face-to-face with his worst fear: the object of his desire, Christine, a blonde noblewoman and wife of the affluent Marquis de la Cheyniest, Robert, is not there to greet him. Intent on winning her back, André accepts his friend Octave's invitation for a lavish hunting weekend at the aristocrat's palatial country estate at La Coliniere, among hand-picked guests and the mansion's servants. However, intrigue, rivalries, and human weaknesses threaten to expose royalty and paupers alike. Who will breach first the unwritten rules of the game?",https://m.media-amazon.com/images/M/MV5BNzlmNmM0MGMtNzlkYS00OTMzLTgwMTktZTA3ZWMyYWFlYmQ3XkEyXkFqcGc@._V1_SX300.jpg,N/A,Not Rated,08 Apr 1950,True,97%,110 min,The Rules of the Game,movie,N/A,"Jean Renoir, Carl Koch, Beaumarchais",1939,tt0031885,7.9,"31,917",
"Heather Angel, John 'Dusty' King, Constance Collier",N/A,N/A,United States,N/A,Al Christie,"Adventure, Comedy, Mystery",6.3/10,English,,N/A,"Although young and beautiful, schoolteacher Anne Gladden fears a dull future. She finally decides to take a walk on the wild side, splurging on some fashionable new clothes and setting off to find adventure. Her new confidence inspires her to flirt with complete strangers. When a gangster pays unwanted attention to her, she ditches him and flees in his car, unaware that there's a corpse in the backseat. Determined to recover his stolen vehicle and its incriminating cargo the thug begins a desperate search. The oblivious Anne, comes to the aid of a handsome young man stranded alongside the road. Romance blooms, but after the shocking discovery of a body in the trunk, the duo decide they have to return the car. The bickering lovebirds head back to the city, trailed by both the angry gangster and the cops, who suspect the young couple of murder.",https://m.media-amazon.com/images/M/MV5BMmFjOTJmODktMTUyNi00MjA2LTk1MTUtZjJmNWVjYmM5MzFiXkEyXkFqcGc@._V1_SX300.jpg,N/A,Approved,05 Apr 1940,True,,59 min,Half a Sinner,movie,N/A,"Frederick J. Jackson, Dalton Trumbo",1940,tt0032566,6.3,426,
"Cary Grant, Rosalind Russell, Ralph Bellamy",2 wins & 1 nomination,"$296,000",United States,N/A,Howard Hawks,"Comedy, Drama, Romance",7.8/10,"English, French",,N/A,"Having been away for four months, Hildy Johnson walks into the offices of the New York City based The Morning Post, where she is a star reporter, to tell her boss, editor Walter Burns, that she is quitting. The reason for her absence was among other things to get a Reno divorce, from, of all people, Walter, who admits he was a bad husband. Hildy divorced Walter largely because she wanted more of a home life, whereas Walter saw her more as a driven hard-boiled reporter than subservient homemaker. Hildy has also come to tell Walter that she is taking the afternoon train to Albany, where she will be getting married tomorrow to staid straight-laced insurance agent, Bruce Baldwin, with whose mother they will live, at least for the first year. Walter doesn't want to lose Hildy, either as a reporter or a wife, and if he does, doesn't believe Bruce is worthy of her. Walter does whatever he can at least to delay Hildy and Bruce's trip, long enough to persuade Hildy to stay for good. His plan includes doing whatever he can to place Bruce in a bad light, while dangling a big story under her nose, namely covering what the newspaper believes is the unfair imminent execution of convicted cop killer, Earl Williams. Hildy doesn't trust Walter in dealing with her and Bruce in an above board manner, but the lure of what potentially may become the biggest story in years, which includes true love, a bumbling sheriff and a corrupt mayor, the latter's actions largely in light of an upcoming election, may prove to be too much for Hildy to resist, especially if it ends up being an exclusive. Regardless of the story outcome, Hildy will have to decide if the thrill of the chase was worth the anguish on her personal life.",https://m.media-amazon.com/images/M/MV5BMzRhMTQ1ZjEtYzM2MC00OThiLTk3NTEtNGRhNzcwNGM2YWQ4XkEyXkFqcGc@._V1_SX300.jpg,N/A,Approved,18 Jan 1940,True,99%,92 min,His Girl Friday,movie,N/A,"Charles Lederer, Ben Hecht, Charles MacArthur",1940,tt0032599,7.8,"64,510",
"Simone Simon, Tom Conway, Kent Smith",2 wins & 3 nominations total,N/A,United States,N/A,Jacques Tourneur,"Fantasy, Horror, Thriller",7.2/10,"English, Czech, Serbian",85/100,85,"Serbian national Irena Dubrovna, a fashion sketch artist, has recently arrived in New York for work. The first person who she makes a personal connection with there is marine engineer Oliver Reed. The two fall in love and get married despite Irena's reservations, not about Oliver but about herself. She has always felt different than other people, but has never been sure why. She lives close to the zoo, and unlike many of her neighbors is comforted by the sounds of the big cats emanating from the zoo. And although many see it purely as an old wives' tale, she believes the story from her village of ancient residents being driven into witchcraft and evil doing, those who managed to survive by escaping into the mountains. After seeing her emotional pain, Oliver arranges for her to see a psychiatrist to understand why she believes what she does. In therapy, Dr. Judd, the psychiatrist, learns that she also believes, out of that villagers' tale, that she has descended from this evil - women who change into great cats like panthers in passion, anger or jealousy - and that she will turn into a such a dangerous big cat upon being kissed in turn killing her lover and others who have betrayed her. This belief is why she has resisted falling in love before she met Oliver. Learning this information from Irena, Oliver wants to do whatever needed to help her as does Dr. Judd. But Irena's beliefs may be tested when Oliver's friendship with a co-worker named Alice Moore may become more than just friends...",https://m.media-amazon.com/images/M/MV5BNDMzMjc3NmQtNjhjYS00Y2MyLWE4NTUtODVmYTU2Y2JjMGU4XkEyXkFqcGc@._V1_SX300.jpg,N/A,Approved,25 Dec 1942,True,92%,73 min,Cat People,movie,N/A,DeWitt Bodeen,1942,tt0034587,7.2,"27,102",
"Hugh Sinclair, Jean Gillie, Gordon McLeod",N/A,N/A,United States,N/A,Paul L. Stein,"Crime, Drama, Mystery",5.7/10,English,,N/A,"A man murdered at the Saint's doorstep manages to utter a few words to Simon Templar before he dies, sending him off to the quaint resort village of Baycombe where he confronts crime mastermind 'The Tiger' and his gang as they plan to smuggle gold bullion out of the country.",https://m.media-amazon.com/images/M/MV5BZTg1NThjNzAtNjIwMy00NGQ2LTg0ZGMtZjAxYzU2MzA4MDMyXkEyXkFqcGdeQXVyMTk2MzI2Ng@@._V1_SX300.jpg,N/A,Approved,29 Jul 1943,True,,70 min,The Saint Meets the Tiger,movie,N/A,"Leslie Charteris, Leslie Arliss, Wolfgang Wilhelm",1941,tt0036324,5.7,591,
"Frank Buck, June Duprez, Duncan Renaldo",N/A,N/A,United States,N/A,Sam Newfield,"Action, Adventure, Mystery",4.7/10,English,,N/A,A big-game hunter travels to Malaya to help stop the Nazis and Japanese from destroying the rubber industry.,https://m.media-amazon.com/images/M/MV5BNWM0NTk2NzEtZGM1Yi00N2I5LTgyZmYtY2FjNTc5MWFkNThlXkEyXkFqcGdeQXVyMDMxMjQwMw@@._V1_SX300.jpg,N/A,Approved,10 Sep 1943,True,,59 min,Tiger Fangs,movie,N/A,Arthur St. Claire,1943,tt0036439,4.7,105,
"Rita Hayworth, Gene Kelly, Lee Bowman",Won 1 Oscar. 3 wins & 4 nominations total,N/A,United States,N/A,Charles Vidor,"Comedy, Music, Musical",6.7/10,"English, French",,N/A,"Rusty Parker, a red-headed leggy dancer at Danny McGuire's Night Club in Brooklyn, wants to be a successful Broadway star. She enters a contest to be a 'Cover Girl' as a stepping-stone in her career. She reminds the publisher, John Coudair, of his lost love, showgirl Maribelle Hicks. He was engaged to Maribelle, although his wealthy society mother made fun of her. Maribelle left John at the altar when she saw the piano at her wedding. It reminded her of the piano-player she truly loved. Rusty is Maribelle's granddaughter and there are musical sequences with Maribelle dancing to songs from the beginning of the 20th century. Rusty lands on the cover of her grandmother's former fiancé's magazine (as a bride). She is pursued by Coudair's pal, the wealthy theatrical producer, Noel Wheaton. He produces a lavish musical to star Rusty, surrounded by real cover girls of the mid 1940's. Rusty runs down a huge spiral into the arms of dozens of men who seem clumsy next to her ethereal dancing. But her success threatens Danny McGuire. He expressed his distress that his girlfriend will find success without him in Kelly's famous dance with himself, 'Alter Ego'. He and his sidekick, Genius, leave New York and entertain soldiers fighting in World War II. Rusty agrees to marry Noel, dazzled by success, security, and his power and money. But she drinks and loses weight because her heart belongs to Danny. She receives a symbolic pearl with great power and tells Coudair and Wheaton that she must spend her life with the man she loves.",https://m.media-amazon.com/images/M/MV5BYTgzODZjYWEtY2M3YS00NTJmLWEzYjctNDU2NjBkODE0ZDBlXkEyXkFqcGc@._V1_SX300.jpg,N/A,Approved,06 Apr 1944,True,95%,107 min,Cover Girl,movie,N/A,"Virginia Van Upp, Marion Parsonnet, Paul Gangelin",1944,tt0036723,6.7,"6,168",
"Allan Lane, Linda Stirling, Duncan Renaldo",N/A,N/A,United States,N/A,"Spencer Gordon Bennet, Wallace Grissell","Adventure, Thriller",6.7/10,English,,N/A,"Greedy oil speculators, led by Morgan, are trying to force Tiger Woman and her band of warriors from their jungle home. Allen Saunders of Inter-Ocean Oil wants to develop the oil, too, but fights with Tiger Woman to stop the bad guys.",https://m.media-amazon.com/images/M/MV5BZjcyM2E5MmEtZWViMy00YWEzLWFiOTctMGVhMDY5NjYwOTk5XkEyXkFqcGdeQXVyMDUyOTUyNQ@@._V1_SX300.jpg,N/A,Approved,27 May 1944,True,,196 min,The Tiger Woman,movie,N/A,"Royal K. Cole, Ronald Davidson, Basil Dickey",1944,tt0037378,6.7,148,
"Pinto Colvig, Milt Kahl, James MacDonald",N/A,N/A,United States,N/A,"Jack Kinney, Burt Gillett","Animation, Comedy, Family",7.0/10,English,,N/A,"Big game hunter Goofy is riding his trusty elephant in search of a tiger. Unfortunately, while they are stopped for lunch, the tiger finds them, and soon enough, Goofy is separated from his rifle. The tiger toys with the goof for a while, then peels off the sole of one shoe and heads for the foot. Meanwhile, Goofy's been preparing a hotfoot for his tormentor, which gets him a small head start on the chase that follows. After a fair bit of chasing, Goofy's elephant comes to the rescue.",https://m.media-amazon.com/images/M/MV5BMGZmZDFhYjQtYmQ5Zi00MGVmLWIzN2MtM2NjNWM4OTdlM2RmXkEyXkFqcGc@._V1_SX300.jpg,N/A,Approved,05 Jan 1945,True,,7 min,Tiger Trouble,movie,N/A,Bill Peet,1945,tt0038174,7.0,579,
"Anton Walbrook, Marius Goring, Moira Shearer",Won 2 Oscars. 5 wins & 5 nominations total,N/A,United Kingdom,N/A,"Michael Powell, Emeric Pressburger","Drama, Music, Romance",8.1/10,"English, French, Russian",,N/A,"Under the authoritarian rule of charismatic ballet impressario Boris Lermontov, his proteges realize the full promise of their talents, but at a price: utter devotion to their art and complete loyalty to Lermontov himself. Under his near-obsessive guidance, young ballerina Victoria Page is poised for superstardom, but earns Lermontov's scorn when she falls in love with Julian Craster, composer of ""The Red Shoes,"" the ballet Lermontov is staging to showcase her talents. Vicky leaves the company and marries Craster, but still finds herself torn between Lermontov's demands and those of her heart.",https://m.media-amazon.com/images/M/MV5BMjRjMzAxMmMtMTkzNS00ZGIyLTgzM2UtODgyYjI5NGEwZDhjXkEyXkFqcGc@._V1_SX300.jpg,N/A,Not Rated,22 Oct 1948,True,98%,135 min,The Red Shoes,movie,N/A,"Hans Christian Andersen, Emeric Pressburger, Keith Winter",1948,tt0040725,8.1,"40,925",
"Edvin Adolphson, Erik 'Bullen' Berglund, Margareta Fahlén",N/A,N/A,Sweden,N/A,Gustaf Edgren,Drama,,Swedish,,N/A,Johan Tiger is an actor in Stockholm during World War II. A British agent in Sweden discovers that Johan is a dead ringer for General Lucky and manages to lure him over to London with a role as Othello as bait.,https://m.media-amazon.com/images/M/MV5BMWJhMTY3YjAtNzYzZi00NjJjLTlhMzctMGJmMjgxMWExMGU0XkEyXkFqcGdeQXVyMjUyNDk2ODc@._V1_SX300.jpg,N/A,N/A,18 May 1948,True,,90 min,En svensk tiger,movie,N/A,"Gustaf Edgren, Oscar Rydqvist",1948,tt0040853,N/A,12,
"Chishû Ryû, Setsuko Hara, Yumeji Tsukioka",5 wins,"$13,254",Japan,N/A,Yasujirô Ozu,"Comedy, Drama",8.2/10,Japanese,93/100,93,"Noriko is 27 years old and is still living with her father Somiya, a widower. Noriko just recovered from an illness she developed in the war, and now the important question pops up: when will Noriko start thinking about marriage? Everybody who is important in her life tries to talk her into it: her father, her aunt, a girlfriend. But Noriko doesn't want to get married, she seems extremely happy with her life. She wants to stay with her father to take care of him. After all, she knows best of his manners and peculiarities. But Noriko's aunt doesn't want to give up. She arranges a partner for her and thinks of a plan that will convince Noriko her father can be left alone.",https://m.media-amazon.com/images/M/MV5BOTAxZjZhOTctY2E1Yi00MTFmLWEzOWEtZGNhYzkwNjdiZTYyXkEyXkFqcGc@._V1_SX300.jpg,N/A,Not Rated,21 Jul 1972,True,100%,110 min,Late Spring,movie,N/A,"Kazuo Hirotsu, Kôgo Noda, Yasujirô Ozu",1949,tt0041154,8.2,"19,919",
"Gregory Peck, Ava Gardner, Melvyn Douglas",N/A,N/A,United States,N/A,"Robert Siodmak, Mervyn LeRoy",Drama,6.6/10,English,,N/A,"A young writer goes to Wiesbaden to write about gambling and gamblers, only to ultimately become a compulsive gambler himself. Losing all his wealth, as well as his moral fibre, he commits the ultimate degradation of robbing a church poor box in order to feed his compulsion.",https://m.media-amazon.com/images/M/MV5BNjk1NDE3ODUtN2JiMS00ZTUxLWI0YmYtNmZhYjE1MTk4MjUxXkEyXkFqcGc@._V1_SX300.jpg,N/A,Approved,29 Jun 1949,True,,110 min,The Great Sinner,movie,N/A,"Ladislas Fodor, Christopher Isherwood, René Fülöp-Miller",1949,tt0041430,6.6,"1,650",
"Betty Ann Davies, Sheila Burrell, Sidney James",N/A,N/A,United Kingdom,N/A,Francis Searle,Thriller,6.0/10,English,,N/A,"Henry Clavering suspects his second wife Bertha is trying to drive his daughter (by his first marriage) insane, to stop her inheriting his money. He decides to use his yoga skills to pretend to be dead, and thereby expose her villainy.",https://m.media-amazon.com/images/M/MV5BZmVjMGE1ODMtNDEwOC00M2ZkLTljOGItZWFmMmE2ZDNhMWNmXkEyXkFqcGdeQXVyMzYyMzU2OA@@._V1_SX300.jpg,N/A,N/A,01 Jan 1950,True,,80 min,The Man in Black,movie,N/A,"John Dickson Carr, John Gilling, Francis Searle",1950,tt0041627,6.0,284,
